{"selected":[{"opportunity_id":"synthetic-1","mission_id":"m1","expected_revenue_cents":4000,"expected_profit_cents":3000,"margin_bps":7500,"profit_per_hour_cents":180000,"expected_duration_ms":60000,"required_slots":1,"resource_locks":[],"estimated_cost_cents":1000}],"rejected":[],"allocated_slots":1,"reserved_cost_cents":1000,"fingerprint":"aaaaaaaaaaaaaaaaaaaaaaaaaaaaaaaaaaaaaaaaaaaaaaaaaaaaaaaaaaaaaaaa"}
